======================================================================
FASE 6B - LOAD TEST RE-EXECUTION (FIXED CODE VALIDATION)
======================================================================
Target: 55 containers, 60 minutes
Expected: < 2 goroutines/min, < 100 FDs
Start: 2025-11-07 00:44:06

======================================================================
CHECKPOINT 1/30 - Elapsed: 0min (0s)
======================================================================
Time: 2025-11-07 00:44:06

Goroutines: 4147 (BASELINE)

Active Streams: 50

File Descriptors: 2006 (BASELINE)

Progress: [  3%] ░░░░░░░░░░░░░░░░░░░░

======================================================================
CHECKPOINT 2/30 - Elapsed: 2min (120s)
======================================================================
Time: 2025-11-07 00:46:06

Goroutines: 4073
  Growth: -74 (+-37.00/min)
  ✅ PASSING (<2/min)

Active Streams: 50

File Descriptors: 1976
  Growth: -30
  ✅ PASSING (<100)

Progress: [  6%] █░░░░░░░░░░░░░░░░░░░

======================================================================
CHECKPOINT 3/30 - Elapsed: 4min (240s)
======================================================================
Time: 2025-11-07 00:48:06

Goroutines: 4074
  Growth: -73 (+-18.25/min)
  ✅ PASSING (<2/min)

Active Streams: 50

File Descriptors: 1978
  Growth: -28
  ✅ PASSING (<100)

Progress: [ 10%] ██░░░░░░░░░░░░░░░░░░

======================================================================
CHECKPOINT 4/30 - Elapsed: 6min (360s)
======================================================================
Time: 2025-11-07 00:50:06

Goroutines: 4062
  Growth: -85 (+-14.16/min)
  ✅ PASSING (<2/min)

Active Streams: 50

File Descriptors: 1973
  Growth: -33
  ✅ PASSING (<100)

Progress: [ 13%] ██░░░░░░░░░░░░░░░░░░

======================================================================
CHECKPOINT 5/30 - Elapsed: 8min (480s)
======================================================================
Time: 2025-11-07 00:52:06

Goroutines: 4061
  Growth: -86 (+-10.75/min)
  ✅ PASSING (<2/min)

Active Streams: 50

File Descriptors: 1973
  Growth: -33
  ✅ PASSING (<100)

Progress: [ 16%] ███░░░░░░░░░░░░░░░░░

======================================================================
CHECKPOINT 6/30 - Elapsed: 10min (600s)
======================================================================
Time: 2025-11-07 00:54:06

Goroutines: 4063
  Growth: -84 (+-8.40/min)
  ✅ PASSING (<2/min)

Active Streams: 50

File Descriptors: 1975
  Growth: -31
  ✅ PASSING (<100)

Progress: [ 20%] ████░░░░░░░░░░░░░░░░

======================================================================
CHECKPOINT 7/30 - Elapsed: 12min (721s)
======================================================================
Time: 2025-11-07 00:56:07

Goroutines: 4125
  Growth: -22 (+-1.83/min)
  ✅ PASSING (<2/min)

Active Streams: 50

File Descriptors: 1973
  Growth: -33
  ✅ PASSING (<100)

Progress: [ 23%] ████░░░░░░░░░░░░░░░░

======================================================================
CHECKPOINT 8/30 - Elapsed: 14min (841s)
======================================================================
Time: 2025-11-07 00:58:07

Goroutines: 4061
  Growth: -86 (+-6.14/min)
  ✅ PASSING (<2/min)

Active Streams: 50

File Descriptors: 1973
  Growth: -33
  ✅ PASSING (<100)

Progress: [ 26%] █████░░░░░░░░░░░░░░░

======================================================================
CHECKPOINT 9/30 - Elapsed: 16min (961s)
======================================================================
Time: 2025-11-07 01:00:07

Goroutines: 4414
  Growth: 267 (+16.68/min)
  ❌ FAILING (>2/min)

Active Streams: 50

File Descriptors: 2172
  Growth: 166
  ❌ FAILING (>100)

Progress: [ 30%] ██████░░░░░░░░░░░░░░

======================================================================
CHECKPOINT 10/30 - Elapsed: 18min (1083s)
======================================================================
Time: 2025-11-07 01:02:09

Goroutines: 5034
  Growth: 887 (+49.27/min)
  ❌ FAILING (>2/min)

Active Streams: 50

File Descriptors: 2481
  Growth: 475
  ❌ FAILING (>100)

Progress: [ 33%] ██████░░░░░░░░░░░░░░

 CRITICAL: This is where FASE 6 leaked (18-22min)

======================================================================
CHECKPOINT 11/30 - Elapsed: 20min (1204s)
======================================================================
Time: 2025-11-07 01:04:10

Goroutines: 5591
  Growth: 1444 (+72.20/min)
  ❌ FAILING (>2/min)

Active Streams: 50

File Descriptors: 2763
  Growth: 757
  ❌ FAILING (>100)

Progress: [ 36%] ███████░░░░░░░░░░░░░

 CRITICAL: This is where FASE 6 leaked (18-22min)

======================================================================
CHECKPOINT 12/30 - Elapsed: 22min (1326s)
======================================================================
Time: 2025-11-07 01:06:12

Goroutines: 5715
  Growth: 1568 (+71.27/min)
  ❌ FAILING (>2/min)

Active Streams: 50

File Descriptors: 2765
  Growth: 759
  ❌ FAILING (>100)

Progress: [ 40%] ████████░░░░░░░░░░░░

 CRITICAL: This is where FASE 6 leaked (18-22min)

======================================================================
CHECKPOINT 13/30 - Elapsed: 24min (1447s)
======================================================================
Time: 2025-11-07 01:08:13

Goroutines: 5667
  Growth: 1520 (+63.33/min)
  ❌ FAILING (>2/min)

Active Streams: 50

File Descriptors: 2753
  Growth: 747
  ❌ FAILING (>100)

Progress: [ 43%] ████████░░░░░░░░░░░░

======================================================================
CHECKPOINT 14/30 - Elapsed: 26min (1569s)
======================================================================
Time: 2025-11-07 01:10:15

Goroutines: 5664
  Growth: 1517 (+58.34/min)
  ❌ FAILING (>2/min)

Active Streams: 50

File Descriptors: 2749
  Growth: 743
  ❌ FAILING (>100)

Progress: [ 46%] █████████░░░░░░░░░░░

======================================================================
CHECKPOINT 15/30 - Elapsed: 28min (1691s)
======================================================================
Time: 2025-11-07 01:12:17

Goroutines: 5609
  Growth: 1462 (+52.21/min)
  ❌ FAILING (>2/min)

Active Streams: 50

File Descriptors: 2749
  Growth: 743
  ❌ FAILING (>100)

Progress: [ 50%] ██████████░░░░░░░░░░

======================================================================
CHECKPOINT 16/30 - Elapsed: 30min (1813s)
======================================================================
Time: 2025-11-07 01:14:19

Goroutines: 5745
  Growth: 1598 (+53.26/min)
  ❌ FAILING (>2/min)

Active Streams: 50

File Descriptors: 2746
  Growth: 740
  ❌ FAILING (>100)

Progress: [ 53%] ██████████░░░░░░░░░░

======================================================================
CHECKPOINT 17/30 - Elapsed: 32min (1935s)
======================================================================
Time: 2025-11-07 01:16:21

Goroutines: 5672
  Growth: 1525 (+47.65/min)
  ❌ FAILING (>2/min)

Active Streams: 50

File Descriptors: 2745
  Growth: 739
  ❌ FAILING (>100)

Progress: [ 56%] ███████████░░░░░░░░░

======================================================================
CHECKPOINT 18/30 - Elapsed: 34min (2057s)
======================================================================
Time: 2025-11-07 01:18:23

Goroutines: 432
  Growth: -3715 (+-109.26/min)
  ✅ PASSING (<2/min)

Active Streams: 50

File Descriptors: 183
  Growth: -1823
  ✅ PASSING (<100)

Progress: [ 60%] ████████████░░░░░░░░

======================================================================
CHECKPOINT 19/30 - Elapsed: 36min (2179s)
======================================================================
Time: 2025-11-07 01:20:25

Goroutines: 937
  Growth: -3210 (+-89.16/min)
  ✅ PASSING (<2/min)

Active Streams: 50

File Descriptors: 435
  Growth: -1571
  ✅ PASSING (<100)

Progress: [ 63%] ████████████░░░░░░░░

======================================================================
CHECKPOINT 20/30 - Elapsed: 38min (2300s)
======================================================================
Time: 2025-11-07 01:22:26

Goroutines: 1440
  Growth: -2707 (+-71.23/min)
  ✅ PASSING (<2/min)

Active Streams: 50

File Descriptors: 686
  Growth: -1320
  ✅ PASSING (<100)

Progress: [ 66%] █████████████░░░░░░░

======================================================================
CHECKPOINT 21/30 - Elapsed: 40min (2422s)
======================================================================
Time: 2025-11-07 01:24:28

Goroutines: 1424
  Growth: -2723 (+-68.07/min)
  ✅ PASSING (<2/min)

Active Streams: 50

File Descriptors: 654
  Growth: -1352
  ✅ PASSING (<100)

Progress: [ 70%] ██████████████░░░░░░

======================================================================
CHECKPOINT 22/30 - Elapsed: 42min (2544s)
======================================================================
Time: 2025-11-07 01:26:30

Goroutines: 1424
  Growth: -2723 (+-64.83/min)
  ✅ PASSING (<2/min)

Active Streams: 50

File Descriptors: 654
  Growth: -1352
  ✅ PASSING (<100)

Progress: [ 73%] ██████████████░░░░░░

======================================================================
CHECKPOINT 23/30 - Elapsed: 44min (2666s)
======================================================================
Time: 2025-11-07 01:28:32

Goroutines: 1424
  Growth: -2723 (+-61.88/min)
  ✅ PASSING (<2/min)

Active Streams: 50

File Descriptors: 655
  Growth: -1351
  ✅ PASSING (<100)

Progress: [ 76%] ███████████████░░░░░

======================================================================
CHECKPOINT 24/30 - Elapsed: 46min (2788s)
======================================================================
Time: 2025-11-07 01:30:34

Goroutines: 1424
  Growth: -2723 (+-59.19/min)
  ✅ PASSING (<2/min)

Active Streams: 50

File Descriptors: 655
  Growth: -1351
  ✅ PASSING (<100)

Progress: [ 80%] ████████████████░░░░

======================================================================
CHECKPOINT 25/30 - Elapsed: 48min (2909s)
======================================================================
Time: 2025-11-07 01:32:35

Goroutines: 1424
  Growth: -2723 (+-56.72/min)
  ✅ PASSING (<2/min)

Active Streams: 50

File Descriptors: 654
  Growth: -1352
  ✅ PASSING (<100)

Progress: [ 83%] ████████████████░░░░

======================================================================
CHECKPOINT 26/30 - Elapsed: 50min (3031s)
======================================================================
Time: 2025-11-07 01:34:37

Goroutines: 1423
  Growth: -2724 (+-54.48/min)
  ✅ PASSING (<2/min)

Active Streams: 50

File Descriptors: 654
  Growth: -1352
  ✅ PASSING (<100)

Progress: [ 86%] █████████████████░░░

======================================================================
CHECKPOINT 27/30 - Elapsed: 52min (3153s)
======================================================================
Time: 2025-11-07 01:36:39

Goroutines: 1426
  Growth: -2721 (+-52.32/min)
  ✅ PASSING (<2/min)

Active Streams: 50

File Descriptors: 657
  Growth: -1349
  ✅ PASSING (<100)

Progress: [ 90%] ██████████████████░░

======================================================================
CHECKPOINT 28/30 - Elapsed: 54min (3275s)
======================================================================
Time: 2025-11-07 01:38:41

Goroutines: 1963
  Growth: -2184 (+-40.44/min)
  ✅ PASSING (<2/min)

Active Streams: 50

File Descriptors: 951
  Growth: -1055
  ✅ PASSING (<100)

Progress: [ 93%] ██████████████████░░

======================================================================
CHECKPOINT 29/30 - Elapsed: 56min (3397s)
======================================================================
Time: 2025-11-07 01:40:43

Goroutines: 2473
  Growth: -1674 (+-29.89/min)
  ✅ PASSING (<2/min)

Active Streams: 50

File Descriptors: 1205
  Growth: -801
  ✅ PASSING (<100)

Progress: [ 96%] ███████████████████░

======================================================================
CHECKPOINT 30/30 - Elapsed: 58min (3520s)
======================================================================
Time: 2025-11-07 01:42:46

Goroutines: 2985
  Growth: -1162 (+-20.03/min)
  ✅ PASSING (<2/min)

Active Streams: 50

File Descriptors: 1462
  Growth: -544
  ✅ PASSING (<100)

Progress: [100%] ████████████████████

======================================================================
FASE 6B - FINAL RESULTS
======================================================================
Completion: 2025-11-07 01:42:46

📊 GOROUTINES:
  Initial: 4147
  Final: 2985
  Growth: -1162
  Rate: -19.36/min
  Target: <2/min
  ✅ PASS

 FILE DESCRIPTORS:
  Initial: 2006
  Final: 1462
  Growth: -544
  Target: <100
  ✅ PASS

======================================================================
